{
  "$schema": "https://json-schema.org/draft/2020-12/schema",
  "$id": "http://example.com/schemas/movie.schema.json",
  "type": "object",
  "title": "Movie",
  "description": "Information about a movie",
  "required": ["title", "director", "year", "rating"],
  "properties": {
    "title": {
      "type": "string",
      "description": "Title of the movie"
    },
    "director": {
      "type": "string",
      "description": "Director's name"
    },
    "year": {
      "type": "number",
      "description": "Release year",
      "minimum": 1800,
      "maximum": 2100
    },
    "rating": {
      "type": "number",
      "description": "IMDB rating",
      "minimum": 0,
      "maximum": 10
    },
    "genre": {
      "type": "array",
      "description": "Movie genres",
      "items": {
        "type": "string"
      }
    },
    "duration": {
      "type": "number",
      "description": "Duration in minutes",
      "minimum": 1
    },
    "description": {
      "type": "string",
      "description": "Plot description"
    }
  }
}
